Entry,HGNC,GeneType,Entry.name,Status,Protein.names,Gene.names,Organism,Length
O94972,TRIM37,Oncogene,TRI37_HUMAN,reviewed,E3 ubiquitin-protein ligase TRIM37 (EC 2.3.2.27) (Mulibrey nanism protein) (RING-type E3 ubiquitin transferase TRIM37) (Tripartite motif-containing protein 37),TRIM37 KIAA0898 MUL POB1,Homo sapiens (Human),964
Q92574,TSC1,TS,TSC1_HUMAN,reviewed,Hamartin (Tuberous sclerosis 1 protein),TSC1 KIAA0243 TSC,Homo sapiens (Human),1164
P49815,TSC2,TS,TSC2_HUMAN,reviewed,Tuberin (Tuberous sclerosis 2 protein),TSC2 TSC4,Homo sapiens (Human),1807
O75896,TUSC2,TS,TUSC2_HUMAN,reviewed,Tumor suppressor candidate 2 (Fusion 1 protein) (Fus-1 protein) (PDGFA-associated protein 2),TUSC2 C3orf11 FUS1 LGCC PDAP2,Homo sapiens (Human),110
Q9H3M7,TXNIP,TS,TXNIP_HUMAN,reviewed,Thioredoxin-interacting protein (Thioredoxin-binding protein 2) (Vitamin D3 up-regulated protein 1),TXNIP VDUP1,Homo sapiens (Human),391
O94874,UFL1,TS,UFL1_HUMAN,reviewed,E3 UFM1-protein ligase 1 (EC 2.3.2.-) (E3 UFM1-protein transferase 1) (Novel LZAP-binding protein) (Regulator of C53/LZAP and DDRGK1),UFL1 KIAA0776 NLBP RCAD,Homo sapiens (Human),794
Q13107,USP4,Oncogene,UBP4_HUMAN,reviewed,Ubiquitin carboxyl-terminal hydrolase 4 (EC 3.4.19.12) (Deubiquitinating enzyme 4) (Ubiquitin thioesterase 4) (Ubiquitin-specific-processing protease 4) (Ubiquitous nuclear protein homolog),USP4 UNP UNPH,Homo sapiens (Human),963
P35125,USP6,Oncogene,UBP6_HUMAN,reviewed,Ubiquitin carboxyl-terminal hydrolase 6 (EC 3.4.19.12) (Deubiquitinating enzyme 6) (Proto-oncogene TRE-2) (Ubiquitin thioesterase 6) (Ubiquitin-specific-processing protease 6),USP6 HRP1 TRE2,Homo sapiens (Human),1406
P15498,VAV1,Oncogene,VAV_HUMAN,reviewed,Proto-oncogene vav,VAV1 VAV,Homo sapiens (Human),845
P40337,VHL,TS,VHL_HUMAN,reviewed,von Hippel-Lindau disease tumor suppressor (Protein G7) (pVHL),VHL,Homo sapiens (Human),213
O00534,VWA5A,TS,VMA5A_HUMAN,reviewed,von Willebrand factor A domain-containing protein 5A (Breast cancer suppressor candidate 1) (BCSC-1) (Loss of heterozygosity 11 chromosomal region 2 gene A protein),VWA5A BCSC1 LOH11CR2A,Homo sapiens (Human),786
Q9BZH6,WDR11,Oncogene,WDR11_HUMAN,reviewed,WD repeat-containing protein 11 (Bromodomain and WD repeat-containing protein 2) (WD repeat-containing protein 15),WDR11 BRWD2 KIAA1351 WDR15,Homo sapiens (Human),1224
O95388,WISP1,Oncogene,WISP1_HUMAN,reviewed,WNT1-inducible-signaling pathway protein 1 (WISP-1) (CCN family member 4) (Wnt-1-induced secreted protein),WISP1 CCN4,Homo sapiens (Human),367
P04628,WNT1,Oncogene,WNT1_HUMAN,reviewed,Proto-oncogene Wnt-1 (Proto-oncogene Int-1 homolog),WNT1 INT1,Homo sapiens (Human),370
P56703,WNT3,Oncogene,WNT3_HUMAN,reviewed,Proto-oncogene Wnt-3 (Proto-oncogene Int-4 homolog),WNT3 INT4,Homo sapiens (Human),355
P19544,WT1,TS,WT1_HUMAN,reviewed,Wilms tumor protein (WT33),WT1,Homo sapiens (Human),449
Q9NZC7,WWOX,TS,WWOX_HUMAN,reviewed,WW domain-containing oxidoreductase (EC 1.1.1.-) (Fragile site FRA16D oxidoreductase) (Short chain dehydrogenase/reductase family 41C member 1),WWOX FOR SDR41C1 WOX1,Homo sapiens (Human),414
Q9GZV5,WWTR1,Oncogene,WWTR1_HUMAN,reviewed,WW domain-containing transcription regulator protein 1 (Transcriptional coactivator with PDZ-binding motif),WWTR1 TAZ,Homo sapiens (Human),400
Q6GPH4,XAF1,TS,XAF1_HUMAN,reviewed,XIAP-associated factor 1 (BIRC4-binding protein),XAF1 BIRC4BP XIAPAF1,Homo sapiens (Human),301
Q8IZH2,XRN1,TS,XRN1_HUMAN,reviewed,5'-3' exoribonuclease 1 (EC 3.1.13.-) (Strand-exchange protein 1 homolog),XRN1 SEP1,Homo sapiens (Human),1706
P46937,YAP1,Oncogene,YAP1_HUMAN,reviewed,Transcriptional coactivator YAP1 (Yes-associated protein 1) (Protein yorkie homolog) (Yes-associated protein YAP65 homolog),YAP1 YAP65,Homo sapiens (Human),504
P07947,YES1,Oncogene,YES_HUMAN,reviewed,Tyrosine-protein kinase Yes (EC 2.7.10.2) (Proto-oncogene c-Yes) (p61-Yes),YES1 YES,Homo sapiens (Human),543
Q05516,ZBTB16,Oncogene,ZBT16_HUMAN,reviewed,Zinc finger and BTB domain-containing protein 16 (Promyelocytic leukemia zinc finger protein) (Zinc finger protein 145) (Zinc finger protein PLZF),ZBTB16 PLZF ZNF145,Homo sapiens (Human),673
A1YPR0,ZBTB7C,TS,ZBT7C_HUMAN,reviewed,Zinc finger and BTB domain-containing protein 7C (Affected by papillomavirus DNA integration in ME180 cells protein 1) (APM-1) (Zinc finger and BTB domain-containing protein 36) (Zinc finger protein 857C),ZBTB7C APM1 ZBTB36 ZNF857C,Homo sapiens (Human),619
Q8IUH5,ZDHHC17,TS,ZDH17_HUMAN,reviewed,Palmitoyltransferase ZDHHC17 (EC 2.3.1.225) (Huntingtin yeast partner H) (Huntingtin-interacting protein 14) (HIP-14) (Huntingtin-interacting protein 3) (HIP-3) (Huntingtin-interacting protein H) (Putative MAPK-activating protein PM11) (Putative NF-kappa-B-activating protein 205) (Zinc finger DHHC domain-containing protein 17) (DHHC-17),ZDHHC17 HIP14 HIP3 HYPH KIAA0946 HSPC294,Homo sapiens (Human),632
Q96K21,ZFYVE19,Oncogene,ANCHR_HUMAN,reviewed,Abscission/NoCut checkpoint regulator (ANCHR) (MLL partner containing FYVE domain) (Zinc finger FYVE domain-containing protein 19),ZFYVE19 ANCHR MPFYVE,Homo sapiens (Human),471
Q15326,ZMYND11,TS,ZMY11_HUMAN,reviewed,Zinc finger MYND domain-containing protein 11 (Adenovirus 5 E1A-binding protein) (Bone morphogenetic protein receptor-associated molecule 1) (Protein BS69),ZMYND11 BRAM1 BS69,Homo sapiens (Human),602
A2RRD8,ZNF320,Oncogene,ZN320_HUMAN,reviewed,Zinc finger protein 320,ZNF320,Homo sapiens (Human),509
Q96K83,ZNF521,Oncogene,ZN521_HUMAN,reviewed,Zinc finger protein 521 (Early hematopoietic zinc finger protein) (LYST-interacting protein 3),ZNF521 EHZF LIP3,Homo sapiens (Human),1311
